id,subject,exam_no,question_text,created_at,type_of_ac,kategori
33439640-9e9d-4966-bc5c-75d2b8883a6c,INITIAL,1,Which is the correct one concerning the movement of Rotate the Control Wheel?,2026-02-23 02:23:37.249262+00,B777-300 ER,Airframe & Powerplant
337c7804-04b1-4bcf-a886-0e3d18c12d4c,INITIAL,1,On of fluid drain line through a hole in the left Fan Cowl panel is :,2026-02-23 02:23:22.124483+00,B737-MAX,Electric & Avionic
3390c01d-4166-4370-a695-70967ba1a931,INITIAL,1,Which light is automatically dimmed when the cockpit dooris opened and the engine are running?,2026-02-23 02:21:48.340267+00,Airbus A330-Series,Airframe & Powerplant
339da329-9b33-4afe-aacc-a3eb92f673f0,INITIAL,1,All chapter of the miantenance manual are grouped under four major heading :,2026-02-23 02:24:13.835793+00,All Aircraft,REGULASI
339e8d65-9199-41a3-8b63-04e7d589baf0,INITIAL,1,Part 43 dalam CASR berlaku untuk :,2026-02-23 02:48:47.574254+00,All Aircraft,REGULASI
33b9c276-d1b6-4269-afb0-d29dcbdbbc6c,INITIAL,1,Who is responsible to Approved the RVSM Operations within airspace designated as Reduced Vertical Separation Minimum airspace (CASR 91.180a]?,2026-02-23 02:48:53.876881+00,All Aircraft,REGULASI
33ccc9f4-e566-4c27-b850-44d7078caec4,INITIAL,1,"Below is B777 Pneumatic system operation mode, except?",2026-02-27 04:07:06.713736+00,B777-300 ER,Airframe & Powerplant
33ec081e-659c-4674-945f-85efe1af7299,INITIAL,1,Hold Item List (HIL) :,2026-02-23 02:24:10.030049+00,All Aircraft,REGULASI
3428d6e7-b8d2-445c-b60b-d5bcd99c9944,INITIAL,1,"With one flap PCU motor inopertive, the flap system :",2026-02-23 02:21:53.479163+00,Airbus A330-Series,Airframe & Powerplant
342b899f-1d34-441a-81f4-68ccf19114e7,INITIAL,1,What is the right statement about the two cargo fire extinguisher bottles ?,2026-02-27 02:16:23.298696+00,Airbus A330 NEO,Electric & Avionic
34302c62-1c68-4087-a1c1-d81d2271e1b1,INITIAL,1,"What is the procedure of an Approved Maintenance Organisation (AMO] may fabricate, in conformity with maintenance data, a restricted range of parts ?",2026-02-23 02:49:00.361407+00,All Aircraft,REGULASI
3436d913-033e-4142-a545-f061a5861c37,INITIAL,1,When does APU door open on ground are,2026-02-23 02:48:31.909117+00,CRJ1000,Airframe & Powerplant
3450a055-0659-4360-ad72-1cf59de501d8,INITIAL,1,How many DEU's and Coax Couplers are installed in the CSD system?',2026-02-23 02:22:29.291308+00,B737-800 NG,Airframe & Powerplant
3460e96b-af53-4593-8961-779b44be9d43,INITIAL,1,"Three access panels per ""C"" duct gives access to the aft attachments of the hyd. controls actuators. Which panel serve as air exit way in case of bull nose seal failure.",2026-02-23 02:22:37.859387+00,B737-800 NG,Airframe & Powerplant
34656b8f-e8be-48fa-8e0a-465aa3fa48c4,INITIAL,1,"Who is responsible for the Airworthiness of an, if the maintenance of the aircraft is contracted to Repair Station (AMO):",2026-02-23 02:49:02.036236+00,All Aircraft,REGULASI
347ab264-3b52-4123-ba33-3d5c70498765,INITIAL,1,The key and flag system is used to unlocked the Fan Cowl Door latch no :,2026-02-27 01:56:10.756432+00,Airbus A330 NEO,Airframe & Powerplant
3489c9fb-057d-4501-a0a3-361f5dc4d6d5,INITIAL,1,What is the potable water panel indication if the water level in the associated tank is almost empty,2026-02-23 02:23:53.271109+00,CRJ1000,Airframe & Powerplant
34b83ec3-e01b-4dfc-a2c0-2cec6872ed4d,INITIAL,1,"The "" DRIVE "" light comes on when corresponding IDG oil ?",2026-02-23 02:22:45.783146+00,B737-800 NG,Airframe & Powerplant
34b9be9c-5d08-4fbe-bb0a-4af5345e41f8,INITIAL,1,Thermal air for wing anti-icing is obtained from :,2026-02-23 02:23:19.750168+00,B737-MAX,Electric & Avionic
34ced75e-15cd-4bd8-a15b-a4faa247c98c,INITIAL,1,"On the MCDU RAD NAV page, when display on small font station frequency to identification codes come from :",2026-02-23 02:22:06.756826+00,Airbus A330-Series,Electric & Avionic
34d329f2-1e4f-4a76-b4d1-370e64189052,INITIAL,1,Which of the following component in the flight deck that is used to control the audio volume in communication system?,2026-02-27 04:06:25.246882+00,B777-300 ER,Airframe & Powerplant
34d6d971-61a9-41b5-ac00-88144fb8695d,INITIAL,1,"If Detection is overheat detection / loop overheat , what is condition ?",2026-02-27 02:16:19.30254+00,Airbus A330 NEO,Electric & Avionic
3501a2b5-4399-401b-8b32-f2574cdb5074,INITIAL,1,"Regarding to the CASR part 145, Certifying personnel to approve an article for return to service. If employee by a certificated AMO located inside the arepublik of Indonesia :",2026-02-23 02:24:25.032913+00,All Aircraft,REGULASI
35501cd0-5b98-4bb5-a5a0-efe6f756eb62,INITIAL,1,The power of ACP and REU is coming from:,2026-02-23 02:22:53.754918+00,B737-800 NG,Electric & Avionic
3565735b-b3ce-4979-a89d-9bffc15b29e4,INITIAL,1,"Requirement for the identification of Aircraft, Aircraft Engines, and Propellers that are made manufacture under the term of a Type or Production Certificates are prescribes on ?",2026-02-23 02:24:36.459136+00,All Aircraft,REGULASI
356de1d1-2cfa-40a7-b625-981ef17f37ee,INITIAL,1,"With the TEMP SEL push-button in AUTO, the electronic temperature controller computes temperature control valve position taking in to account:",2026-02-23 02:46:57.669944+00,ATR72,Airframe & Powerplant
357735db-db69-4449-896b-e8d05597c138,INITIAL,1,What is function of the TBV system,2026-02-23 02:22:41.597546+00,B737-800 NG,Airframe & Powerplant
35b40349-4f62-4406-aa1c-06bbee55700f,INITIAL,1,Five main engine bearings hold the N1 shaft and the N2 shaft. Number 3 are the dual assy bearing. Which bearing absorb the axial and the radial loads from the shaft?,2026-02-23 02:22:59.176063+00,B737-800 NG,Electric & Avionic
35c60732-8bf9-4426-a19d-4d812b9d4c29,INITIAL,1,"The Authorized personnel have to record after Engine Ground Run has been performed Ref. Current GA-CMM XV-6 as mention below are correct, except:",2026-02-23 02:49:11.447202+00,All Aircraft,REGULASI
35da47de-bc69-40e5-ad27-4796bc55b003,INITIAL,1,Where and how is the N2 vibration indicated ?,2026-02-23 02:23:47.51431+00,CRJ1000,Airframe & Powerplant
3621dd42-82ab-4903-9779-349daf29825b,INITIAL,1,When turning the B737-800 with winglets on the ground,2026-02-27 04:03:40.360306+00,B737-800 NG,Electric & Avionic
36375c25-0275-44fa-8583-042e6655b100,INITIAL,1,When does the DISCH light come on ?,2026-02-23 02:21:43.397282+00,Airbus A330-Series,Airframe & Powerplant
363be7a6-80fe-4598-9cfd-5cc80f8a6d1a,INITIAL,1,What has the Engine Electronic Controller (EEC) authority once an automatic Engine start in case of the incidents ?,2026-02-23 02:22:09.321606+00,Airbus A330-Series,Electric & Avionic
364a4074-35fb-4417-8871-81746831b38f,INITIAL,1,A SPOILERONS ROLL caution message is display on EICAS,2026-02-23 02:23:53.529055+00,CRJ1000,Airframe & Powerplant
365b361e-ae6f-452a-b9e3-300cca6dfc7c,INITIAL,1,"Manufacturers who produce replacement part/component for type certificated aircraft must hold: ",2026-02-23 02:48:43.163211+00,All Aircraft,REGULASI
36641a58-ff9e-41c3-a563-21f96ee69884,INITIAL,1,Repair interval in the category D shall be repaired within :,2026-02-23 02:48:49.309896+00,All Aircraft,REGULASI
36833fc0-b7f3-4434-9b2c-6fc883490254,INITIAL,1,"What is the privilege of the Holder Category ""Bl"" Certifying Staff authorization?",2026-02-23 02:48:54.488147+00,All Aircraft,REGULASI
3683d928-d874-4c95-ab2c-9b37d95287ad,INITIAL,1,"Who has responsible Certiication or Stamping of Job cards ETOPS in the Inspection Column of ETOPS Job Cards, ETOPS Task in the MSAO and ETOPS Task in the MDR?",2026-02-23 02:49:11.543945+00,All Aircraft,REGULASI
368402ad-9f8b-4be9-a20c-2e94960f93a6,INITIAL,1,Certificate of Registration is valid for a period not to exceed than :,2026-02-23 02:24:30.357935+00,All Aircraft,REGULASI
36eac36d-5a5b-481a-8537-bd9d4ec6f2b3,INITIAL,1,What Hyd. System Have time delay on ACMP pump Control Circuit ?,2026-02-23 02:23:51.590403+00,CRJ1000,Airframe & Powerplant
36f29366-6cb9-4484-bf3c-250ecc893332,INITIAL,1,Which statement below the Aileron is correct,2026-02-23 02:21:58.213244+00,Airbus A330-Series,Airframe & Powerplant
371a07da-a4b0-4d10-860b-8a33b0f28eaf,INITIAL,1,"Access to the flight control computer (FCC) diagnostics is through : ",2026-02-23 02:48:38.277061+00,CRJ1000,Electric & Avionic
371ebcaa-83c2-4e13-8c59-4bb2686de4c0,INITIAL,1,What is the function of Speed Trim ?,2026-02-23 02:22:43.121057+00,B737-800 NG,Airframe & Powerplant
373f0f56-c186-4fbd-ba99-a2a23cbdf94e,INITIAL,1,"Refer to the CASR Part 65 , a license may be issued  to a person who meets the following requirements :",2026-02-23 02:49:03.07416+00,All Aircraft,REGULASI
3752752a-104b-488f-b481-006d61cfeeba,INITIAL,1,Normal yaw damping is performed with:,2026-02-23 02:22:28.885731+00,B737-800 NG,Airframe & Powerplant
376252ff-37a8-47f0-921e-782607ec03b8,INITIAL,1,When the avionics vent system extract fan should stop ?,2026-02-23 02:47:02.371864+00,ATR72,Electric & Avionic
37cebe3a-900d-4e93-a408-20a32d616314,INITIAL,1,What are the commads received by the rudder mechanical input?,2026-02-23 02:21:44.013217+00,Airbus A330-Series,Airframe & Powerplant
37daa614-ec17-4b73-9823-c960fa71cad4,INITIAL,1,A licensed AME with a powerplant rating may perform the :,2026-02-23 02:48:58.653344+00,All Aircraft,REGULASI
37dda696-f465-4bf4-b863-35c8608133dd,INITIAL,1,Function test means :,2026-02-23 02:24:20.849772+00,All Aircraft,REGULASI
37ebbbef-4282-4b2e-9223-0f5aaa81d804,INITIAL,1,Five main engine bearings hold the NI shaft and the N2 shaft. Number 3 are the dual assy bearing. Which bearing absorb the axial and the radial loads from the shaft?,2026-02-23 02:22:38.247982+00,B737-800 NG,Airframe & Powerplant
37f64e92-8f6f-4a1f-8296-693896ac7089,INITIAL,1,Whathappened does the indication parameter during Engine Starting process in the A330 Aircraft powered by RR Trent 700?,2026-02-23 02:22:08.760967+00,Airbus A330-Series,Electric & Avionic
3819b63f-e1cf-4036-a41f-0953e17edfbc,INITIAL,1,What does the green Rev show on EICAS display?,2026-02-27 04:06:19.854378+00,B777-300 ER,Airframe & Powerplant
3865097b-44d6-4e1e-ab50-ee2081148de9,INITIAL,1,What are the function of High Stage Regulator?,2026-02-23 02:22:34.056443+00,B737-800 NG,Airframe & Powerplant
38dbaa7b-988c-4241-b7b8-08965e056256,INITIAL,1,What is indicated by a flashing P15 fuel gauge during fueling operation?,2026-02-23 02:22:33.554334+00,B737-800 NG,Airframe & Powerplant
38e48283-8af5-4e60-94fd-1605d7b8b543,INITIAL,1,During engine operation what will happen if you move start lever to cut off position?,2026-02-23 02:23:06.20461+00,B737-MAX,Airframe & Powerplant
38e7d577-46f7-4f7c-a767-ffed0bab4c7a,INITIAL,1,"An aircraft to be considered airworthy if: ",2026-02-23 02:48:41.71433+00,All Aircraft,REGULASI
38f5fb3c-03b4-42a8-81c9-9d5e072ecbac,INITIAL,1,"What is the type of data will recorded by FDR ",2026-02-23 02:23:50.128005+00,CRJ1000,Airframe & Powerplant
38ff861e-7d6e-4849-9a7e-036bdc040ab0,INITIAL,1,"With ground power plugged in and the battery switch OFF, the Dim Entry Lights are powered",2026-02-27 04:01:15.261606+00,B737-800 NG,Electric & Avionic
39467f91-b182-42db-9627-16a8ceb4b1a7,INITIAL,1,"This alert message ""MAIN GEAR BRACE L"" shows",2026-02-27 04:10:49.603183+00,B777-300 ER,Electric & Avionic
39482c79-27b4-4815-8e73-ccef5341ceb9,INITIAL,1,Which bearing is a dual bearing (roll / ball assembly)?,2026-02-23 02:22:38.715206+00,B737-800 NG,Airframe & Powerplant
39591aec-ca69-42f5-bf72-b99222673a4b,INITIAL,1,Refusing with passengers on board recommended when:,2026-02-23 02:48:50.640956+00,All Aircraft,REGULASI
39927cd0-b8d6-4376-90c5-20f88c9bd0df,INITIAL,1,The data recorded by QAR is used for :,2026-02-23 02:23:50.368933+00,CRJ1000,Airframe & Powerplant
39937c0a-6953-4667-a7ba-47d4bfc7250a,INITIAL,1,How can you select a DME :,2026-02-23 02:22:22.891126+00,ATR72,Electric & Avionic
39a3a54c-b420-451c-b5bc-b8ed14cc8955,INITIAL,1,Stick shaker advice is actived by :,2026-02-23 02:22:24.941736+00,ATR72,Electric & Avionic
39d1525f-c7ea-4fed-ba02-fa6197fef997,INITIAL,1,What is the main function of the FADEC?,2026-02-23 02:21:50.668259+00,Airbus A330-Series,Airframe & Powerplant
39e186b5-237b-4dc0-a8db-ffad5703aec0,INITIAL,1,When does the ATC Transponder have periodically tested and inspection Ref. CASR 91.215a. ?,2026-02-23 02:49:11.054139+00,All Aircraft,REGULASI
39fc7e62-8369-4318-8731-ba02e616f1a5,INITIAL,1,Hp bleed air source from,2026-02-27 01:56:14.460144+00,Airbus A330 NEO,Airframe & Powerplant
3a33234e-a6df-493f-a5be-252577b5babc,INITIAL,1,"Incase of total loss of AC buses 1 and 2, when is the CSM/G active ?",2026-02-23 02:22:01.93773+00,Airbus A330-Series,Electric & Avionic
3a39ae35-f489-462b-98fd-e3ee44668b9f,INITIAL,1,When an AFT CARGO OVHT coution message is displayed :,2026-02-23 02:23:45.886526+00,CRJ1000,Airframe & Powerplant
3a3f4ad5-f1ee-4611-91f7-1371757676d5,INITIAL,1,What is the purpose of the DDG :,2026-02-23 02:48:48.354875+00,All Aircraft,REGULASI
3a6d79ca-9abc-42da-80bb-e158cadcd9dc,INITIAL,1,"In IAS Hold mode, the magenta speed bug on the airspeed scale indicate that :",2026-02-23 02:22:21.674807+00,ATR72,Electric & Avionic
3a8cd283-8121-45bc-b900-12981a13e6eb,INITIAL,1,"With FMC U10, after TOGA is pressed for a go-around, the CRZ page will show.",2026-02-23 02:23:25.929851+00,B737-MAX,Electric & Avionic
3a9250a2-bc88-42f9-8375-0797c54c045d,INITIAL,1,Engine receives Fuel from aircraft fuel tank thought LPSOV control by,2026-02-27 01:56:13.887614+00,Airbus A330 NEO,Airframe & Powerplant
3a93f9c9-3152-4ea3-a097-03ca8a51e4e7,INITIAL,1,"How can EEC channel "" A "" be powered if the EEC alternator power supply fails ?",2026-02-23 02:23:25.049888+00,B737-MAX,Electric & Avionic
3aae0b6a-e0f8-4301-aaa2-151111860159,INITIAL,1,"In case of a LOOP failure, the availability of the fire detection is obtained  :",2026-02-23 02:22:14.737836+00,ATR72,Airframe & Powerplant
3abc9ac7-2788-4ae4-8fa3-8ea192c6b10e,INITIAL,1,"Regarding to the Appendix A to CASR 43 , replacing fuel / oil filter element  and replacing magnetic chip detector are  defined as :",2026-02-23 02:49:02.878903+00,All Aircraft,REGULASI
3ac71dd6-539e-47b8-98f9-dd03278220c4,INITIAL,1,Which statement is true about the rudder pedals?,2026-02-23 02:23:32.348975+00,B777-300 ER,Airframe & Powerplant
3aec88e5-9942-4b97-8121-d72b52f04c6f,INITIAL,1,How can an overpressure discharge of the bottle be detected?,2026-02-23 02:21:43.099304+00,Airbus A330-Series,Airframe & Powerplant
3aed865f-044a-458a-b9ee-b57514324731,INITIAL,1,What is the different between economy cooling mode and standby cooling mode?,2026-02-27 04:10:53.669892+00,B777-300 ER,Electric & Avionic
3b058f14-32cf-4a3f-a336-dc50a01ae2ce,INITIAL,1,"Defect, malfunction. In accordance with CASR 121.703, shall reported to the local aviation authority within?",2026-02-23 02:24:30.256286+00,All Aircraft,REGULASI
3b16f841-0faf-4ff6-8086-e454379209bd,INITIAL,1,"With Ground Service switch is pressed, and ext.power is applied what indication in External power panel?",2026-02-23 02:23:28.760262+00,B777-300 ER,Airframe & Powerplant
3b26fec5-8ca9-4277-8add-943721a80307,INITIAL,1,"What is the ETOPS Parallel system i n the ETOPS Aircraft Maintenance ,means ?",2026-02-23 02:49:01.846122+00,All Aircraft,REGULASI
3b5b800b-8aff-4b4f-8aa4-dd892d66bb53,INITIAL,1,What is the Air Worthiness Directive in Aircraft Maintenance means?,2026-02-23 02:48:52.534382+00,All Aircraft,REGULASI
3b66f194-4bbe-42be-a32d-dd8e5462cfc0,INITIAL,1,External gear box is driven by:,2026-02-27 01:56:13.185661+00,Airbus A330 NEO,Airframe & Powerplant
3bb2523a-0f69-4cd7-9572-97c34834ec81,INITIAL,1,What  components to  prevent surface flutter in event of hydraulic loss at PCUS and provides gust lock on ground ?,2026-02-23 02:48:17.708919+00,CRJ1000,Airframe & Powerplant
3bb984be-ae50-4585-a5ed-6c86c6caf091,INITIAL,1,What is the function of speed trim?,2026-02-23 02:22:34.351958+00,B737-800 NG,Airframe & Powerplant
3be460d8-ed02-460a-80a9-028beaa371ab,INITIAL,1,When does the brake pressure indication change to Amber,2026-02-23 02:23:53.626072+00,CRJ1000,Airframe & Powerplant
3be6629a-6020-4fb4-a479-7b05fb7edb43,INITIAL,1,"The requirement Ref CASR 91.146(b) or CMM VI, When refueling with passengersnembarking, on board or disembarking, as mention bellow ,except?",2026-02-23 02:24:26.632354+00,All Aircraft,REGULASI
3bf4b56b-ce7c-42ba-9a96-bbf6a46fe0ad,INITIAL,1,What is the purpose of the wash filter located in the engine fuel pump?,2026-02-23 02:22:31.034128+00,B737-800 NG,Airframe & Powerplant
3bfd7ca0-6f4a-4b23-bc4e-312b367dff09,INITIAL,1,When left hand engine start sequence is initiated:,2026-02-23 02:22:11.178725+00,ATR72,Airframe & Powerplant
3c12a58d-f0ee-45b1-9f05-aa099a3ea308,INITIAL,1,What is the device which manages all audio from all communication systems,2026-02-27 04:06:24.949351+00,B777-300 ER,Airframe & Powerplant
3c193d56-6df8-48ed-a5b7-e36e08432e55,INITIAL,1,What is right concerning the cargo fire protection system,2026-02-23 02:22:35.165727+00,B737-800 NG,Airframe & Powerplant
3c231bd3-d271-499e-93c5-eac9af6f2bb8,INITIAL,1,During engine starting the starterand ignition will automatically cut off due to operation of a switch located in the,2026-02-23 02:22:37.200408+00,B737-800 NG,Airframe & Powerplant
3c2563b7-1daf-4284-9fe5-8dd5d493602f,INITIAL,1,For EEC operation,2026-02-23 02:22:37.674398+00,B737-800 NG,Airframe & Powerplant
3c481129-7cc3-410a-a500-74a6b3acfb4f,INITIAL,1,What happens when the IR 1 P/B is set to OFF ?,2026-02-23 02:21:55.516933+00,Airbus A330-Series,Airframe & Powerplant
3c679941-8977-4d31-8aff-28613cd3ab3f,INITIAL,1,How do you stop all electrical operation of the stabilizer trim?,2026-02-23 02:22:29.087298+00,B737-800 NG,Airframe & Powerplant
3c6a84fa-f886-4439-a392-617b2208a906,INITIAL,1,When does the Maintenance Procedure (M) in the MEL should be performed by the Certifyng Staff ?,2026-02-23 02:49:11.936183+00,All Aircraft,REGULASI
3c9c446d-aedd-44f1-9611-d119d66c85aa,INITIAL,1,What is the maintenance recording responsibility of the person who complies with an Airworthiness Directive ?,2026-02-23 02:49:03.267879+00,All Aircraft,REGULASI
3ced3a91-9f8a-4235-883b-91d6689bdfa1,INITIAL,1,"What is the repair clasification if cannot be done by elementary operations or if improperly done, might appreciably affect weight and balance, structural strength, performance, power plant operation, flight characteristics, or other qualities affecting airworthiness ?",2026-02-23 02:48:59.613834+00,All Aircraft,REGULASI
3d20e365-b8dd-4afd-88bb-4897bce8419f,INITIAL,1,"The Nl speed sensor is a tripple sensor comprising three independent monopole circuits and outputs. Two N1 speed signal's, one for each channel is send to the EEC. The third signal send to;",2026-02-23 02:22:39.87449+00,B737-800 NG,Airframe & Powerplant
3d5de503-c303-4e82-ba11-114df59a157f,INITIAL,1,The ADU (Air Drive Unit) heaters,2026-02-27 04:10:49.019826+00,B777-300 ER,Electric & Avionic
3d8140d0-4f20-4dc9-ac16-97940b3f900f,INITIAL,1,In which case will the Ram Air Turbine (RAT) automatically pressurize the green system?,2026-02-23 02:21:46.336565+00,Airbus A330-Series,Airframe & Powerplant
3d8f322d-76cc-4a12-bc89-996cbc8d85ba,INITIAL,1,"With two engines operating, changes the engine thrust limit to the FMC selected climbnthrust.",2026-02-23 02:23:37.840987+00,B777-300 ER,Airframe & Powerplant
3dd20fcd-5f90-4865-88b6-3dc8a1b2015c,INITIAL,1,During Flight the Elevator Tab control mechanism is controlled by ?,2026-02-23 02:22:45.023365+00,B737-800 NG,Airframe & Powerplant
3df13abb-6824-482c-b706-e2061015bce8,INITIAL,1,The green AVAIL light in the DC PWR push button illuminates when :,2026-02-23 02:46:58.691984+00,ATR72,Electric & Avionic
3df8d564-9c4c-43ce-b4f6-bef7af46a498,INITIAL,1,Where is the ground lock safety pin install for MLG ?,2026-02-23 02:23:56.161061+00,CRJ1000,Airframe & Powerplant
3e3f9bef-7db7-4090-a822-1a2ca243c504,INITIAL,1,What is the function of Intervention Switch Mode ?,2026-02-23 02:23:26.064446+00,B737-MAX,Electric & Avionic
3e63340e-805e-441b-9989-71d537e30ec4,INITIAL,1,In which case an aircraft can fly without a valid Certificate of Airworthiness?,2026-02-23 02:24:11.693161+00,All Aircraft,REGULASI
3e65fb7a-52bc-4052-b6de-cb11f006da94,INITIAL,1,Where is the location of ILS receiver :,2026-02-23 02:22:57.192596+00,B737-800 NG,Electric & Avionic
3e6c851f-2d11-441a-bcfc-1344b71f1df9,INITIAL,1,Transitiom from approach idle to ground idle is delayed 5 second after touch down. That function is for:,2026-02-23 02:22:41.302197+00,B737-800 NG,Airframe & Powerplant
3e74cbdf-7a64-4619-8324-03a0190757ad,INITIAL,1," What switch position when hydraulic pumps IB and 2B will operate when they are powered, the flaps are not at zero, and the generator on the opposite side engine is operating?",2026-02-23 02:23:57.868605+00,CRJ1000,Airframe & Powerplant
3e7b5f5c-94bc-440b-b662-774715fd25ab,INITIAL,1,"Engine fire protection , When condition the Fault state occurred ?",2026-02-27 01:56:15.844714+00,Airbus A330 NEO,Airframe & Powerplant
3e86cd6f-351a-455f-bdd2-cd716fdd9dc5,INITIAL,1,How does the starter operate?,2026-02-23 02:21:51.177169+00,Airbus A330-Series,Airframe & Powerplant
3e946765-17f1-4354-a23a-ffbf08637393,INITIAL,1,Handling Bleed Valve (HBV) automatic operations are controlled by :,2026-02-23 02:46:51.482509+00,ATR72,Airframe & Powerplant
3e9f34f4-e9f8-49d1-9d06-6fb65d7dafa1,INITIAL,1,The total temperature probe:,2026-02-23 02:22:36.082386+00,B737-800 NG,Airframe & Powerplant
3eaec7ae-68b7-476b-8f89-69643cbd3f4a,INITIAL,1,How long should an AHRS initialization take while the aircraft is on ground ?,2026-02-23 02:48:38.374393+00,CRJ1000,Electric & Avionic
3eb2e2a9-028a-4345-8bd0-b70dccd18b41,INITIAL,1,If a high APU generator oll temperature detection occurs :,2026-02-23 02:21:52.219432+00,Airbus A330-Series,Airframe & Powerplant
3ed76394-6df8-4f18-97ca-db29f6b8fa77,INITIAL,1,"Regarding to the CASR part 145, certifying Personnel to approve an article for return to service. If employee by a certificated AMO located inside the Republic of Indonesia:",2026-02-23 02:49:02.132636+00,All Aircraft,REGULASI
3f3417e1-b610-4dec-b853-06e614ce9ad8,INITIAL,1,Commands from the Flight Control Computers (FCC) are received by :,2026-02-23 02:23:58.062954+00,CRJ1000,Airframe & Powerplant
3f52a5f7-d45d-4687-bd3a-3c472547bebd,INITIAL,1,What can you say about the parking brake is the PARKING BRAKE SET message is not displayed?,2026-02-23 02:23:32.76203+00,B777-300 ER,Airframe & Powerplant
3f539feb-1d3c-4b30-af8d-0c827357698e,INITIAL,1,Where is B777 Main wheel and nose wheel exchangeability change be found on?,2026-02-27 04:07:07.186784+00,B777-300 ER,Airframe & Powerplant
3f5525e9-bfaa-4eac-94f5-7dfd946bb705,INITIAL,1,Where can you find Non Correlated Maintenance Msg of PFCS?,2026-02-27 04:07:11.769409+00,B777-300 ER,Airframe & Powerplant
3f87cfa4-ad7b-4c10-84f9-b0cd7a78c6b4,INITIAL,1,"All aviation personnel must hold a license, obtained through education and training. This is stipulated in Aviation Law No. :",2026-02-23 02:24:15.047031+00,All Aircraft,REGULASI
3fac3f0b-289a-4a52-9c1e-443582855c55,INITIAL,1,what happens if both C1 and C2 DEMANDS pump selectors are positioned to ON?,2026-02-27 04:07:23.865216+00,B777-300 ER,Airframe & Powerplant
3fc9b0e9-58c2-4a0a-90c5-15581357aa80,INITIAL,1,How is the FREE FALL system operated?,2026-02-23 02:21:47.669311+00,Airbus A330-Series,Airframe & Powerplant
3fd071de-e656-4a5c-bec1-97a3d51098fb,INITIAL,1,"The two cowl halves ('C"" duct) are held together by six tension latches at the bottom. How to opened the latches.",2026-02-23 02:23:22.383491+00,B737-MAX,Electric & Avionic
3fff7c86-7891-4cb1-afea-efe034cc777e,INITIAL,1,What happens if one CID's - decoder/encoder unit ( DEU ) fails ?,2026-02-23 02:22:06.433129+00,Airbus A330-Series,Electric & Avionic
404111e1-deb7-4047-9824-2d768d99e740,INITIAL,1,The Operability bleed valve (OBV) is commanded open during engine start to unload the compressor. What air is bleed to the atmosphere?,2026-02-23 02:48:26.616589+00,CRJ1000,Airframe & Powerplant
4042ce1b-2a55-431b-b090-fd86ce4c968f,INITIAL,1,What is the function of the T/R interlock actuator on the ASM brake assembly?,2026-02-27 04:06:19.540287+00,B777-300 ER,Airframe & Powerplant
407d1c7b-6a54-4c8a-a4c2-f4067ab90af6,INITIAL,1,"In accordance with CASR Part 145.31, all metal construction of large aircraft is :",2026-02-23 02:49:08.28408+00,All Aircraft,REGULASI
40833fed-1bae-4077-ba8b-04b20baaf085,INITIAL,1,"To get A production Certificate, should have ?",2026-02-23 02:49:05.431135+00,All Aircraft,REGULASI
410722b1-4d08-4626-9d77-3aa4c2de9827,INITIAL,1,"Illumination of the avionics vent panel exhaust mode push-button OVBD light, causes the ground mechanic call horn to sound :",2026-02-23 02:47:02.565526+00,ATR72,Electric & Avionic
41287f43-682b-448f-85fd-18e96dc2eb44,INITIAL,1,The emergency air-driven generator (ADG) manual deploy hadle and ADG control panel are located on :,2026-02-23 02:24:02.518396+00,CRJ1000,Electric & Avionic
414e1c22-f6c6-4cfb-99a3-d03c4fe45f3e,INITIAL,1,How is the emergency locator transmitter (ELT) reset when it has been activated by the g-switch ?,2026-02-23 02:48:24.215675+00,CRJ1000,Airframe & Powerplant
41657ecc-3524-4367-96e3-0a22c3cc19e7,INITIAL,1,What is the step action has to be taken in case of FIRE while fueling or defueling operations ?,2026-02-23 02:24:35.036459+00,All Aircraft,REGULASI
416a6278-fd61-41a3-a28a-87bc1f5939e9,INITIAL,1,N3 indicated on ECAM from?,2026-02-27 02:16:17.03733+00,Airbus A330 NEO,Electric & Avionic
419d2ad5-434b-4c49-95e9-a1a74393eab6,INITIAL,1,Main aerodynamic station of HPC Inlet is:,2026-02-27 01:57:06.72698+00,Airbus A330 NEO,Airframe & Powerplant
41ade5df-13fb-4246-adfe-d68345886a85,INITIAL,1,What is indicated by an illuminated ENGINE CONTROL light?,2026-02-23 02:22:31.136692+00,B737-800 NG,Airframe & Powerplant
