id,subject,exam_no,question_text,created_at,type_of_ac,kategori
bc54d0ce-f728-49bf-8343-1aa6ed735998,INITIAL,1,When does the two igniter continuous ignition can be function energizes during Enginenrunning to give protection from the engine flame out?,2026-02-23 02:22:09.104713+00,Airbus A330-Series,Electric & Avionic
bc925519-e86a-4d64-b588-8b5fbb622ce1,INITIAL,1," What is the maximum load on the passenger entry door",2026-02-23 02:48:30.234705+00,CRJ1000,Airframe & Powerplant
bc9659e0-c7fa-48eb-9dc1-d18f7d0dc8c9,INITIAL,1,Where is the air inlet door located ?,2026-02-23 02:23:51.172598+00,CRJ1000,Airframe & Powerplant
bcdbe64a-593e-42cd-bd24-e07fadd78884,INITIAL,1,When an AFT CARGO OVHT coution message is displayed :,2026-02-23 02:48:20.52141+00,CRJ1000,Airframe & Powerplant
bd199dad-9e4a-46af-a55c-29d10e81c486,INITIAL,1,"Ref. CMM Page VII-2 Major Phase Check & Ref. QP 209-05 Scope of Base Maintenance, (Squawk Rectification, A- Check, C-Check and D-Check, Exclude Minor MaintenancenCheck) the procedure of Certification or Stamping of Job Cards, MDRs, PD Sheet or MSAO",2026-02-23 02:24:46.356056+00,All Aircraft,REGULASI
bd3c1c8d-1675-423f-bf5c-0be00ce35e57,INITIAL,1,The selected altitute is displayed :,2026-02-23 02:22:21.879939+00,ATR72,Electric & Avionic
bd60ec59-f866-42ac-92dd-d1d260de1d9d,INITIAL,1,When you start the engine:,2026-02-27 04:07:19.284147+00,B777-300 ER,Airframe & Powerplant
bda17bfa-129d-4284-9e01-5087af221a9c,INITIAL,1,"Yang termasuk 'Special Flight Permit"" menurut CASR 21,kecuali:",2026-02-23 02:48:50.928691+00,All Aircraft,REGULASI
bdacea58-d2f7-4123-bca9-e1b8d417c230,INITIAL,1,Cabin load speakers are connected to :,2026-02-23 02:22:04.984935+00,Airbus A330-Series,Electric & Avionic
bdadac97-3534-4fb5-b052-998f6a7002c1,INITIAL,1,What is the funcion of NGL transfer cylinder ?,2026-02-23 02:48:22.859743+00,CRJ1000,Airframe & Powerplant
bdefd1b3-b12f-4e00-9d9e-3eae081b4ea5,INITIAL,1,"Choose the true statements about interference between LE laps or slats and thrust reversers cowl, EXCEPT?",2026-02-23 02:23:05.508607+00,B737-MAX,Airframe & Powerplant
be16d6fc-7d19-4722-a642-c9be25f09853,INITIAL,1,The data you can ind in the data entry plug as mention bellow are correct except:,2026-02-23 02:23:13.474561+00,B737-MAX,Airframe & Powerplant
be42db27-543c-4d5f-b821-7a50dca52dfb,INITIAL,1,Full Authority Digital Engine Control system consists of :,2026-02-27 01:56:11.380185+00,Airbus A330 NEO,Airframe & Powerplant
be5e7bdc-9c47-4b47-bce3-1494cb32128c,INITIAL,1,"On the avionics vent panel, the FAULT light illuminates amber when:",2026-02-23 02:22:11.660833+00,ATR72,Airframe & Powerplant
be641c2a-d57e-4328-ba6c-c0271d179d38,INITIAL,1,"When you disconnect one of two power source from airplane electrical system, what type of load shed may occur?",2026-02-27 04:06:12.231301+00,B777-300 ER,Airframe & Powerplant
be6ee51e-eb11-48de-a861-3e478294e7ff,INITIAL,1,How could you dial a VOR frequency :,2026-02-23 02:22:22.68175+00,ATR72,Electric & Avionic
be94674d-828b-43fe-813d-4269547b462a,INITIAL,1,What are the necessary conditions to extend the RAT ?,2026-02-23 02:22:05.612113+00,Airbus A330-Series,Electric & Avionic
be9cf137-f824-45a5-98d7-dd52efc9ca97,INITIAL,1,"When TRANS COWL is fully deployed the green REV is displayed in the N1 gauge, which component is responsible for this signal ?",2026-02-23 02:23:48.034141+00,CRJ1000,Airframe & Powerplant
beba51ec-0f90-4f13-bf0e-1c9e1a3baeac,INITIAL,1,Where is the Engine Fire Extinguishing Bottle B737 Max is installed?,2026-02-23 02:23:08.283329+00,B737-MAX,Airframe & Powerplant
bebd1814-f034-4297-b147-3a81fe21574c,INITIAL,1,When do you performed the maintenance task Before / Pre-Departure Check of Aircraft ?,2026-02-23 02:48:47.18399+00,All Aircraft,REGULASI
bed7195b-3e2a-4c8c-8605-222e2fd48e97,INITIAL,1,"The electronic control unit (ECU) controls the following APU Function, except :",2026-02-23 02:23:51.070417+00,CRJ1000,Airframe & Powerplant
bed7577c-45c4-4e75-b642-9c8e6ed5f8e1,INITIAL,1,"The dedicated alternator provides alectrical power for the FADEC system, what does the other function?",2026-02-23 02:21:50.127646+00,Airbus A330-Series,Airframe & Powerplant
bf2e5d84-44c5-409f-adf9-2d7eed09c7f4,INITIAL,1,"Any major repair or modification, the Authorized holder responsible to performed the surrounding area shall be inspected for hidden damages, inspection will also be conducted after repair accomplishment as required to issued form :",2026-02-23 02:49:09.516889+00,All Aircraft,REGULASI
bf432057-4a8d-483e-946a-8026300d1cf0,INITIAL,1,Where is AIMS Cabinet position in Main Equipment Center :,2026-02-27 04:10:58.246004+00,B777-300 ER,Electric & Avionic
bf4790fd-ad9c-4a3d-8176-db57238a04e8,INITIAL,1,"The rear mount transmits sideward forces to the strut and wing structures, also :",2026-02-23 02:23:22.479185+00,B737-MAX,Electric & Avionic
bf628e10-dfde-4b62-89dc-a4d0f515c7cc,INITIAL,1,What controls the speed ( rpm ) of the Ram Air Turbine (RAT) generator?,2026-02-23 02:23:29.260126+00,B777-300 ER,Airframe & Powerplant
bf656d40-d4a0-4efb-84a2-27096f59b585,INITIAL,1,All chapter of the miantenance manual are grouped under four major heading :,2026-02-23 02:48:48.07659+00,All Aircraft,REGULASI
bf759317-1ab9-4fd2-9b0f-3b4b80f8d05c,INITIAL,1,"Where is the Data Entri Plug belong to, during maintenance replacement of the Engine or the Electronic Controller (EEC)?",2026-02-23 02:21:56.90922+00,Airbus A330-Series,Airframe & Powerplant
bfbcc66a-ca2a-4e57-9290-84297c020aef,INITIAL,1,When do the roll spoilers begin to move?,2026-02-23 02:46:56.269819+00,ATR72,Airframe & Powerplant
bfc58416-31e5-4271-ada0-32a0c513cb08,INITIAL,1,Which component unlock the no. 1 lock actuator ?,2026-02-23 02:23:47.916669+00,CRJ1000,Airframe & Powerplant
c008eac0-c775-4271-968a-a153f496e2b9,INITIAL,1,Normal yaw damping is performed with :,2026-02-23 02:22:55.580497+00,B737-800 NG,Electric & Avionic
c0406e4f-fa24-48e1-a15b-b045d972b2d4,INITIAL,1,Personnel requirements in each certificated AMO must :,2026-02-23 02:24:24.449901+00,All Aircraft,REGULASI
c046cb5b-c1d7-4494-9082-c4cc49d46656,INITIAL,1,When does the automatic change over of the LGCIU's in control accur ?,2026-02-23 02:21:55.278459+00,Airbus A330-Series,Airframe & Powerplant
c0497a4f-87aa-4608-879e-60cf4f9716d9,INITIAL,1,The pneumatic air Cross bleed valve system on Aircraft A330-800/900 NEO powered by Engine R&R Trent 7000:,2026-02-27 01:56:10.332363+00,Airbus A330 NEO,Airframe & Powerplant
c063c7ee-6947-4f0a-82f7-81c6949050e0,INITIAL,1,"On an unpowered aircraft, is it possible to move the pilots seats ?",2026-02-23 02:21:52.65727+00,Airbus A330-Series,Airframe & Powerplant
c07890b9-72b3-449e-aac4-6ba9f6f696fe,INITIAL,1,Flight data recorder have interface with CPM/Comm with:,2026-02-23 02:23:36.058132+00,B777-300 ER,Airframe & Powerplant
c0795d58-5077-479c-9432-e9b69d95232b,INITIAL,1,Refer to GA-CMM Aircraft Structure Damage Control Sheets (ASDCS) What is the responsible The Certifying Staff as mention bellow Except :,2026-02-23 02:48:49.785301+00,All Aircraft,REGULASI
c087e368-ba84-49d5-a398-dce360b8569a,INITIAL,1,What is Standard Fly Away Kit of Boeing 737-NG for Handling ESDS Component ?,2026-02-23 02:23:02.541413+00,B737-800 NG,Electric & Avionic
c08ac869-5d2e-4efb-b789-587fa38a3c7b,INITIAL,1,TLU is in full autority position while IAS is above 200 KTS :,2026-02-23 02:46:55.675509+00,ATR72,Airframe & Powerplant
c0914ede-8635-4fb2-a02a-eeb736905b4f,INITIAL,1,The ADF inicator is always horizontal :,2026-02-23 02:23:20.695579+00,B737-MAX,Electric & Avionic
c0cd25dd-d820-4948-91e2-3eb781a2957d,INITIAL,1,Which system function below doesn't include on AIMS system :,2026-02-27 04:10:58.023182+00,B777-300 ER,Electric & Avionic
c10f614b-9b1a-4112-8123-e537fa489505,INITIAL,1,Which components are used to send roll commands to the spoiler stabilizer control unitn(SSCU's) ?,2026-02-23 02:48:33.436534+00,CRJ1000,Airframe & Powerplant
c112263f-225a-400a-8b29-4dff59abe7fb,INITIAL,1,What is the meaning of FIDEEX ?,2026-02-23 02:48:25.065296+00,CRJ1000,Airframe & Powerplant
c116aedc-d0db-4188-892d-78a710bc272b,INITIAL,1,"When both CCDL (cross channel data link) EEC fail, what component will take the function of EEC's CCDL?",2026-02-23 02:23:09.061424+00,B737-MAX,Airframe & Powerplant
c11af21a-e744-411e-a279-9bc017ffae55,INITIAL,1,Fire Detector on Aircraft A330-800/900 NEO powered by Engine R&R Trent 7000 installed on:,2026-02-27 01:56:08.029653+00,Airbus A330 NEO,Airframe & Powerplant
c1523991-215e-4938-a87d-2e54ba2d6337,INITIAL,1,How do you stop all electrical operation of the stabilizer trim?,2026-02-23 02:22:55.481891+00,B737-800 NG,Electric & Avionic
c1600d85-632c-4ccb-99ac-87f5ae13e6aa,INITIAL,1,"When APU FIRE is detected on ground, which computer receives signal and close the APU fuel solenoid valve?",2026-02-27 01:56:11.075301+00,Airbus A330 NEO,Airframe & Powerplant
c160232a-98b2-4478-a907-3aaa6fd49b56,INITIAL,1,How to automatically active transmits of ELT G-Switch,2026-02-23 02:48:28.612766+00,CRJ1000,Airframe & Powerplant
c18ea968-c818-4330-92cf-02c221359a73,INITIAL,1,When does the CSM/G GCU autorize the connection to the network ?,2026-02-23 02:22:01.737219+00,Airbus A330-Series,Electric & Avionic
c19ae7f6-ab21-480d-a52c-e7ec3ef15d64,INITIAL,1,Repair interval in the category D shall be repaired within :,2026-02-23 02:24:13.734052+00,All Aircraft,REGULASI
c19b2378-3e82-4b64-aa6d-75b7340afc56,INITIAL,1,"The following accessories is mounted on the front face of the gearbox, except:",2026-02-27 02:16:17.874985+00,Airbus A330 NEO,Electric & Avionic
c1a54ce7-725f-4681-bb83-695b038e63e1,INITIAL,1,When do B pump turn on ?,2026-02-23 02:23:49.022265+00,CRJ1000,Airframe & Powerplant
c1aa1509-fd64-47aa-9449-8254570601f9,INITIAL,1,"On thrust reverser system, which system controlled the tertiary lock?",2026-02-27 02:16:18.783532+00,Airbus A330 NEO,Electric & Avionic
c1c3b165-9e3b-4ac1-b3cf-3f852f5b1a2a,INITIAL,1,What control unit (s) receive radio altimeter (RAD ALT) data ?,2026-02-23 02:23:44.287634+00,CRJ1000,Airframe & Powerplant
c1e23160-e7b3-4f36-a659-de9739eab27d,INITIAL,1,The pressurization system consist of:,2026-02-23 02:22:53.342489+00,B737-800 NG,Electric & Avionic
c1e4dfcc-4f93-49f6-9194-db5f4f7115d0,INITIAL,1,Required Inspection and appropriate personnel:,2026-02-23 02:49:03.792471+00,All Aircraft,REGULASI
c1fcb134-bf4a-49c6-b83b-abc7bee20964,INITIAL,1,"In the MDS system, where you can ind the engine serial number data?",2026-02-23 02:23:10.242415+00,B737-MAX,Airframe & Powerplant
c206e149-d1db-4c29-84f5-972a1757cedf,INITIAL,1,What kind of the test will the FQIS do when you open refueling door or panel?,2026-02-23 02:23:29.949796+00,B777-300 ER,Airframe & Powerplant
c212069b-0508-4b4e-8ac0-a4aee38c994c,INITIAL,1,What is the main function of the restrictor?,2026-02-23 02:21:45.730488+00,Airbus A330-Series,Airframe & Powerplant
c217c6e2-f84a-4d02-826c-f106f5260fb7,INITIAL,1,"The flight Management Application software, the flight Management configuration file and performace database are loaded through a :",2026-02-23 02:47:01.186965+00,ATR72,Electric & Avionic
c2302d43-befa-4d44-adbb-4c0581b1e5cd,INITIAL,1,Pylon temp normally maximal at the,2026-02-27 02:16:15.285683+00,Airbus A330 NEO,Electric & Avionic
c24231b2-17a8-4273-ba41-9829b00a83a9,INITIAL,1,When both motor control unit (MCU) channels fail in the horizontal stabilizer trim system,2026-02-23 02:48:28.812957+00,CRJ1000,Airframe & Powerplant
c2731af2-72df-4e34-b5c4-1f9aece4c6ac,INITIAL,1,The temperature control valve is:,2026-02-23 02:46:56.741535+00,ATR72,Airframe & Powerplant
c2732eec-576a-40ac-9b69-b17ecd435175,INITIAL,1,"If the Customer for any reason does not want to incorporate AD note on due while aircraft is under GMF maintenance and GMF is responsible to issue Certificate Release to Service (CRS), therefore GMF Certifying Staff will ?",2026-02-23 02:48:45.048438+00,All Aircraft,REGULASI
c28ab0c8-bf4f-48e9-80e1-afc98a6560b2,INITIAL,1,What is the definition of DGCA Airworthiness Directives ?,2026-02-23 02:24:29.286221+00,All Aircraft,REGULASI
c2a4224e-5304-4e7a-96b3-37f25cf7bf22,INITIAL,1,Cross- side configuration of the RTU is enable :,2026-02-23 02:48:37.808462+00,CRJ1000,Electric & Avionic
c2c79873-0b4f-44e8-9980-dffd20bd2d41,INITIAL,1,The Continuous Airworthiness Maintenance Program Document [MZ-TD-04-737-800] is prepared in accordance with mention bellow except:,2026-02-23 02:48:50.081162+00,All Aircraft,REGULASI
c2cabb1a-63ca-4f1f-87ec-afd3d110550b,INITIAL,1," What is the result if one of the two thermocouple (tc) rakes fails?",2026-02-23 02:22:30.520431+00,B737-800 NG,Airframe & Powerplant
c2cfb2c8-4457-4e8d-b089-6f112498e37d,INITIAL,1,X bleed valve control by,2026-02-27 02:16:15.603187+00,Airbus A330 NEO,Electric & Avionic
c2cfb4f4-a5a8-403c-8602-ea845affebb5,INITIAL,1,From where are the hydraulic fire shut-off valves operated?,2026-02-23 02:21:46.031069+00,Airbus A330-Series,Airframe & Powerplant
c2dee8ab-5c5b-48f6-ad88-6a1b456db39b,INITIAL,1,The overspeed governor pneumatic protection is performed by the way :,2026-02-23 02:22:12.338723+00,ATR72,Airframe & Powerplant
c2e0539d-10e4-4a41-9079-1f2eccc34bc8,INITIAL,1,"What BPCU check when external power is applied, except?",2026-02-23 02:23:28.561392+00,B777-300 ER,Airframe & Powerplant
c2e5d96f-2c7d-4122-a071-1f6ac0514d8a,INITIAL,1,The DFDR is fail :,2026-02-23 02:23:20.252854+00,B737-MAX,Electric & Avionic
c2e699d3-21ad-450f-920c-0902f6a743af,INITIAL,1,What is the Airworthiness in the Aircraft Maintenance means ?,2026-02-23 02:24:32.372185+00,All Aircraft,REGULASI
c2fa029c-ae40-42dc-808c-75f848bf0e71,INITIAL,1,"What is the function of auto throttle? ",2026-02-23 02:22:34.548438+00,B737-800 NG,Airframe & Powerplant
c320a377-f6f3-40d0-a2eb-98cec5d7b38e,INITIAL,1,Which of the following  statement relating to the slats/flaps electronic control units (SFECU's) is true ?,2026-02-23 02:23:43.39491+00,CRJ1000,Airframe & Powerplant
c3393162-0f2d-4ae6-a4c6-050eff4320d8,INITIAL,1,"Which component supplies the ground to keep the engine start switch in GRD position until until starter cut out? ",2026-02-23 02:22:32.954901+00,B737-800 NG,Airframe & Powerplant
c33e6335-a61f-4ef3-8b6d-a8e40f877aa6,INITIAL,1,What the main trust parameter (RR TRENT 7000) ?,2026-02-27 01:56:14.949245+00,Airbus A330 NEO,Airframe & Powerplant
c33f5f68-6b89-4ee6-8b7b-c9f1b87590b1,INITIAL,1,How many bus tie contactors (BTC) are controlled by the main ELEC PWR PANEL BTC? Push button? :,2026-02-23 02:22:13.639848+00,ATR72,Airframe & Powerplant
c395dc25-b49c-4bc6-99ba-dda30e387741,INITIAL,1,"Regarding to the CASR Partl45, Certifying Personnel to approve an article for return to service. If employee by a certificated AMO located inside the Republic of Indonesia :",2026-02-23 02:24:33.055177+00,All Aircraft,REGULASI
c3aeebd1-0987-4edf-832c-744bf835ac39,INITIAL,1,What haven flight control do you have when roll disc pulled?,2026-02-23 02:24:00.546923+00,CRJ1000,Airframe & Powerplant
c3e19ee9-2da3-45da-905e-1e35c539f16a,INITIAL,1,What is right concerning the cargo fire protection system ?,2026-02-23 02:22:47.631543+00,B737-800 NG,Airframe & Powerplant
c3e62447-6525-427c-b408-fbcb4967ab4f,INITIAL,1,An Engine BLEED TRIP OFF light will illuminate :,2026-02-23 02:23:21.19037+00,B737-MAX,Electric & Avionic
c42bee0a-b712-4da3-bb16-25d52191bf09,INITIAL,1,Repair Interval in the catagory B shall be repaid within :,2026-02-23 02:48:54.617618+00,All Aircraft,REGULASI
c4323e63-4a20-4240-a52a-6c99511ca15d,INITIAL,1,What is the Aircraft Extended Twin Engine Operations (ETOPS)Flight Definition?,2026-02-23 02:24:25.536307+00,All Aircraft,REGULASI
c452bd0b-c69c-41db-ad6e-2d57fbe4df04,INITIAL,1,On CRJ&00/900 the data base unit (DBU) is used for :,2026-02-23 02:48:21.161287+00,CRJ1000,Airframe & Powerplant
c459d62e-e835-449e-9a74-4573591171a5,INITIAL,1,Which one moves first extension vs retraction slats or flaps,2026-02-23 02:48:32.962058+00,CRJ1000,Airframe & Powerplant
c493258a-d119-421c-8041-75584bb2eb08,INITIAL,1,Where is the fuel temperature sensor located ?,2026-02-23 02:24:05.000577+00,CRJ1000,Electric & Avionic
c4a119d5-907c-4f67-86ff-0c19492f67a4,INITIAL,1,"Which detector types are used for engine and APU fire detection? ",2026-02-23 02:22:28.060777+00,B737-800 NG,Airframe & Powerplant
c4a6985b-8ccf-4ab5-b5cd-1afcce9794a2,INITIAL,1,Which of the following emergency conditions will deploy the ram air turbine?,2026-02-23 02:22:08.661507+00,Airbus A330-Series,Electric & Avionic
c4ae3c4d-c87c-4959-ac76-80e5ca55f2ce,INITIAL,1,What is the purpose of the dump valve in the FMU?,2026-02-23 02:21:50.026251+00,Airbus A330-Series,Airframe & Powerplant
c4d1f33e-91fa-4d69-9ccf-683ade00d1e4,INITIAL,1,What is the position the APU inlet door opening during light?,2026-02-23 02:23:03.773502+00,B737-MAX,Airframe & Powerplant
c4d9d5db-62bc-4738-9b8a-7345c689fca5,INITIAL,1,A loss of total pressure data result in :,2026-02-23 02:23:34.078865+00,B777-300 ER,Airframe & Powerplant
c50a93fd-7e9f-408b-8bd4-6d80dc90f24d,INITIAL,1,Which LRU is in charge of controlling the quality of External power?,2026-02-23 02:22:27.481735+00,B737-800 NG,Airframe & Powerplant
c5265d11-75a6-4cac-bbb1-db938b416817,INITIAL,1,Failure of one main A.C. bus causes,2026-02-27 04:01:13.401426+00,B737-800 NG,Electric & Avionic
c52866b3-ece3-4a12-8a80-895e0f766260,INITIAL,1,"During engine start and operation, how many FADEC channels are in control ?",2026-02-23 02:24:05.193053+00,CRJ1000,Electric & Avionic
c55df4bc-9238-40dc-99f6-e51fe88fe7c8,INITIAL,1,"What is the repair interval category can be extended ,if the item falls due from the repair interval?",2026-02-23 02:49:07.485052+00,All Aircraft,REGULASI
c56aa52a-ba8b-41bf-962c-4e0b3be6000d,INITIAL,1,Which of the following issue Airworthiness Directive ?,2026-02-23 02:49:04.8486+00,All Aircraft,REGULASI
c57d4991-86d6-41cc-a130-f8f7c05e6ddb,INITIAL,1,How many motor the outflow valve of cabin pressurize system ?,2026-02-23 02:22:46.082518+00,B737-800 NG,Airframe & Powerplant
c5812a89-235a-42a3-8f2e-a93769be5842,INITIAL,1,Stand by altimeter and air speed indicator is get input from :,2026-02-23 02:22:57.470494+00,B737-800 NG,Electric & Avionic
c5ad620a-5028-42ca-a5ae-939a01d30624,INITIAL,1,"When the aileron trim switch is moved from its detent position, it supplies :",2026-02-23 02:48:40.974826+00,CRJ1000,Electric & Avionic
c5c0f95a-2599-4d70-a985-506515bc3cd1,INITIAL,1,What type of load shedding happens if power source is change from APU generator to primary external power while load is more than 100KVA?,2026-02-27 04:10:55.306595+00,B777-300 ER,Electric & Avionic
c5ccfbbd-db50-4c92-8244-5505ed955c80,INITIAL,1,The COWL ANTI ICE light illuminate:,2026-02-23 02:22:35.98076+00,B737-800 NG,Airframe & Powerplant
c5d5c6a9-cf15-40c9-84a9-57bbaac78957,INITIAL,1,"In case of emergency, how can the crew evacuate the cockpit ?",2026-02-23 02:22:05.815695+00,Airbus A330-Series,Electric & Avionic
c62d8fe8-41fc-4b2b-a0b5-e71d5b4847b1,INITIAL,1,What is the Main Purpose of the ETOPS Flight?,2026-02-23 02:24:19.467727+00,All Aircraft,REGULASI
c631839e-b0d1-49ee-bfbf-f632fcd75994,INITIAL,1,"When does the 'OFF SCHEDULE DESCENT"" light illuminate?",2026-02-23 02:22:27.290502+00,B737-800 NG,Airframe & Powerplant
c6437e92-0aed-4c01-9cc9-652f17c966fd,INITIAL,1,"Refer to CASR Part 145, A certificated AMO may not approve for RTS :",2026-02-23 02:24:29.689155+00,All Aircraft,REGULASI
c659a22c-bd81-41a9-b817-377b8ef4796e,INITIAL,1,"When a DC starter generator is functioning as a starter, how many power sources can it use?",2026-02-23 02:22:13.837749+00,ATR72,Airframe & Powerplant
c682f699-2d21-4a05-a787-8503ee13c3fd,INITIAL,1,The function of TRIM AIR PRESSURE REGULATING VALVE :,2026-02-23 02:22:52.868678+00,B737-800 NG,Electric & Avionic
c69d7fc0-6513-40db-bbf7-9eeacb83b166,INITIAL,1,Which statement is correct if the input of the Electronic Engine Control active channel is failed:,2026-02-27 01:56:11.578306+00,Airbus A330 NEO,Airframe & Powerplant
c6bda84a-3a98-46ff-adb9-dcbd9c9d9234,INITIAL,1,Each operator Certificate holder who will ferform Maintenance and Preventive Maintenance works must meet requirements of,2026-02-23 02:24:20.549934+00,All Aircraft,REGULASI
c6c8649d-5a1e-40f8-b4d2-d64da0bc8e03,INITIAL,1,Does the yoke or rudder pedals move when trimmed ?,2026-02-23 02:23:58.670031+00,CRJ1000,Airframe & Powerplant
c6dfa49c-9148-4057-b2e0-c3325df7aaaf,INITIAL,1,"Who iss responsible for the airworthiness of an, is the maintenance of the aircraft is contracted to Repair Station (AMO) :",2026-02-23 02:24:23.354209+00,All Aircraft,REGULASI
c6e441e9-0439-4448-9264-758261d30774,INITIAL,1,"The maintenance (MAINT) switch, install on :",2026-02-23 02:23:46.525041+00,CRJ1000,Airframe & Powerplant
c7110b3a-5981-4a7b-a022-c2ab2958fd76,INITIAL,1,"What is the procedure of an Approved Maintenance Organization (AMO) may fabricate,nin conformity with maintenance data, a restricted range of parts?",2026-02-23 02:48:53.429054+00,All Aircraft,REGULASI
c71968a2-1684-4109-8299-00fd61d1876f,INITIAL,1,What happens to an IDG if the thermal plug melt,2026-02-27 04:07:21.642993+00,B777-300 ER,Airframe & Powerplant
c7242074-033b-46fd-999e-4f1d00e59fc0,INITIAL,1,"Which one is not correct as mention bellow if the Autothrottle (A/T) ARM Switches selected to ""ARM"" position ?",2026-02-23 02:23:37.944268+00,B777-300 ER,Airframe & Powerplant
c739e8e7-7f4f-41ed-af61-709011ba52aa,INITIAL,1,The ignition consist of........igniter plug,2026-02-27 02:16:16.918302+00,Airbus A330 NEO,Electric & Avionic
c74a607c-458f-4a87-a46e-d3167d502771,INITIAL,1,What initial action is required in the event of a WING BODY OVERHEAT illuminating :,2026-02-23 02:23:21.496588+00,B737-MAX,Electric & Avionic
c7509b70-c4de-4087-b632-8ca34425b2e7,INITIAL,1,Where is the ADP filter module,2026-02-27 04:07:20.763899+00,B777-300 ER,Airframe & Powerplant
c75bf5ff-9513-4025-b3de-e955a8e42ee5,INITIAL,1,The FLT DECK TEMP selector sets the flight dect temperatute to between 65 F and 85 F (n18 C and 29 C. How does the Flight Deck temperature controlled by Manualy?,2026-02-23 02:23:36.251742+00,B777-300 ER,Airframe & Powerplant
c785d07c-3e86-4345-821e-6a002e8a6b94,INITIAL,1,What kind of device to monitor the position of the NWS act ?,2026-02-23 02:23:52.472267+00,CRJ1000,Airframe & Powerplant
c7b2acd7-1d6c-4f08-a42e-d22aded3d042,INITIAL,1,Limitation of aircraft maintenance every operator reference from:,2026-02-23 02:49:02.791755+00,All Aircraft,REGULASI
c7cbe0ef-e09c-42bd-a033-fd763589093b,INITIAL,1,"What's the condition that cause An amber FAULT switch /light iluminates, caution message of IDG 1 (2) is also displayed on EICAS primary page :",2026-02-23 02:23:47.225961+00,CRJ1000,Airframe & Powerplant
c7e091dc-fb9e-46df-aeb3-f80ab2373c03,INITIAL,1,Each engine has an alternate power relay for powering the EEC channel A and channel B. Four flight deck will make the DEU energize the alternate power relay. One action for powering the EEC is ?,2026-02-23 02:23:23.792655+00,B737-MAX,Electric & Avionic
c7f8747c-c730-4435-8e09-7f12b2c8821f,INITIAL,1,Each engine has an alternate power relay for powering the EEC channel A and channel B. Four flight deck will make the DEU energize the alternate power relay. One action for powering the EEC is,2026-02-23 02:22:39.958839+00,B737-800 NG,Airframe & Powerplant
c826fd5f-ff1e-4415-b8f1-44058d91df23,INITIAL,1,As soon as energization of aircraft electrical network :,2026-02-23 02:47:00.424771+00,ATR72,Electric & Avionic
c8350c52-e7c2-4e55-af98-8e0256c3add1,INITIAL,1,What is the function of Intervention Switch Mode ?,2026-02-23 02:23:02.453946+00,B737-800 NG,Electric & Avionic
c84effb1-5098-4a86-847c-6605453b166e,INITIAL,1,Where is the fuel temperature sensor located ?,2026-02-23 02:48:39.159274+00,CRJ1000,Electric & Avionic
c85a6060-c17f-4725-a784-fdc792c3d001,INITIAL,1,"Only the Golden Rod page (Station Copy) should be tear off after completion of entries at out station, and must be retained for 6 (six) months.",2026-02-23 02:24:46.249712+00,All Aircraft,REGULASI
c89fbed7-9098-4373-87b5-0f1f65082972,INITIAL,1,"Who iss responsible for the airworthiness of an, is the maintenance of the aircraft is contracted to Repair Station (AMO) :",2026-02-23 02:48:57.267953+00,All Aircraft,REGULASI
c8a378d5-dbd3-4924-9a7e-da7ce8e4a36f,INITIAL,1,"At cruising condition , what the function of Modulate Air System(MAS) at Trent 7000?",2026-02-27 01:56:14.831316+00,Airbus A330 NEO,Airframe & Powerplant
c8a4a021-7c32-4c18-a36b-097f8a79a83d,INITIAL,1,"Regarding to the CASR Part145, Certifying Personnel to approve an article for return to service. If employee by a certificated AMO located inside the Republic of Indonesia :",2026-02-23 02:49:02.508412+00,All Aircraft,REGULASI
c8ca7c9d-371b-4bc3-af90-5a9ec280875f,INITIAL,1,"When ARMED, the emergency exit lights will automatically come on",2026-02-27 04:01:14.324066+00,B737-800 NG,Electric & Avionic
c90d3dc5-8f57-4907-aca3-063cd41908b1,INITIAL,1,"When does the aircraft ""RVSM Validation Flight Required "" in the Manufacture recommendation to ensure RVSM approval integrity ?",2026-02-23 02:24:26.227876+00,All Aircraft,REGULASI
c938e2d9-4e28-48b2-b4b7-414ac9e66719,INITIAL,1,The First three element of the AMTOSS number defines for :,2026-02-23 02:23:59.645638+00,CRJ1000,Airframe & Powerplant
c940e5b1-be1c-44e0-ae94-3100981ce92b,INITIAL,1,The radio tuning units (RTUs) are used to :,2026-02-23 02:24:03.310066+00,CRJ1000,Electric & Avionic
c94522ee-9be3-47e2-9212-157c118a04dd,INITIAL,1,"When you disconnect one of  two power source from airplane electrical system, what type of load shed may occur?",2026-02-23 02:23:29.381588+00,B777-300 ER,Airframe & Powerplant
c94708ab-087c-48c1-986b-bd22523c6499,INITIAL,1,"When the aileron trim switch is moved from its detent position, it supplies :",2026-02-23 02:48:40.870772+00,CRJ1000,Electric & Avionic
